{
  "schema_version": "1",
  "id": "aider",
  "display_name": "Aider",
  "vendor": "OpenAI / Anthropic",
  "homepage": "https://aider.chat/docs/llms/openai-compat.html",
  "binary_names": ["aider"],
  "args": [],
  "install": "python -m pip install aider-chat",
  "wire_protocol": "openai-chat",
  "injection": {
    "method": "env",
    "env": {}
  },
  "attribution": { "header": "x-cave-agent" },
  "tested_agent_version": "x",
  "fallback": "generic-env",
  "maintainer": null
}
